<?xml version="1.0" encoding="UTF-8"?>

<!--
  Harvest Tool Example Policy File

  This policy file provides an example configuration for registering
  PDS3 products. By specifying the base path below, Harvest crawls
  the directory structure recursively looking for files with an extension
  of "LBL".

  $Id$
-->

<policy xmlns="https://pds.nasa.gov/software/pds4/harvest/v1"
  xmlns:xsi="http://www.w3.org/2001/XMLSchema-instance"
  xmlns:harvest="https://pds.nasa.gov/software/pds4/harvest/v1"
  xsi:schemaLocation="https://pds.nasa.gov/software/pds4/harvest/v1 https://pds.nasa.gov/software/pds4/harvest/v1/harvest-policy.xsd">

  <!-- Specify one or more directories containing the PDS3 data products to register. -->
  <pds3Directories>
    <path>$HOME/VG2-J-PLS-5-SUMM-ELE-MOM-96.0SEC-V1.0/DATA</path>
    <fileFilter>
      <include>*.LBL</include>
    </fileFilter>
  </pds3Directories>

  <accessUrls harvest:registerFileUrls="false">
    <accessUrl>
      <baseUrl>http://starbase.jpl.nasa.gov</baseUrl>
      <offset>$HOME</offset>
    </accessUrl>
  </accessUrls>

  <checksums harvest:generate="true">
    <manifest>$HOME/VG2-J-PLS-5-SUMM-ELE-MOM-96.0SEC-V1.0/CHECKSUMS.TXT</manifest>
  </checksums>

  <candidates>
    <!-- Harvest will register PDS3 data products under the objectType 'Product_Proxy_PDS3'. -->
    <pds3ProductMetadata>
      <!-- Tells Harvest what prefix and element values to use to create the LID. -->
      <lidContents harvest:prefix="urn:nasa:pds" harvest:appendFilename="true">
        <elementName>DATA_SET_ID</elementName>
      </lidContents>

      <!-- Tells Harvest what element values to use to create the title. -->
      <titleContents harvest:appendFilename="true">
        <elementName>DATA_SET_ID</elementName>
      </titleContents>

      <!-- Register static metadata for each product. -->
      <staticMetadata>
        <slot harvest:name="information_model_version">
          <value>1.11.0.0</value>
        </slot>
        <slot harvest:name="product_class">
          <value>Product_Proxy_PDS3</value>
        </slot>
        <slot harvest:name="data_set_ref">
          <value>urn:nasa:pds:context_pds3:data_set:data_set.vg2-j-pls-5-summ-ele-mom-96.0sec-v1.0</value>
        </slot>
        <slot harvest:name="investigation_ref">
          <value>urn:nasa:pds:context_pds3:investigation:mission.voyager</value>
        </slot>
        <slot harvest:name="instrument_host_ref">
          <value>urn:nasa:pds:context_pds3:instrument_host:instrument_host.vg2</value>
        </slot>
        <slot harvest:name="instrument_ref">
          <value>urn:nasa:pds:context_pds3:instrument:instrument.pls_vg2</value>
        </slot>
        <slot harvest:name="target_ref">
          <value>urn:nasa:pds:context_pds3:target:target.planet.jupiter</value>
        </slot>
      </staticMetadata>

      <!-- Register dynamic metadata from elements in the product labels. -->
      <ancillaryMetadata>
        <elementName harvest:slotName="observation_start_date_time">
          START_TIME
        </elementName>
        <elementName harvest:slotName="observation_stop_date_time">
          STOP_TIME
        </elementName>
        <elementName harvest:slotName="product_type">
          PRODUCT_TYPE
        </elementName>
        <elementName harvest:slotName="creation_date_time">
          PRODUCT_CREATION_TIME
        </elementName>
        <elementName harvest:slotName="encoding_type">
          INTERCHANGE_FORMAT
        </elementName>
      </ancillaryMetadata>
    </pds3ProductMetadata>
  </candidates>
</policy>

